{
  "caseId": "retrieval-demo-001",
  "dataVersion": "0.1.0",
  "split": "dev",
  "sourceRights": "synthetic",
  "question": "讲者把学习循环分成哪两个阶段？",
  "timeWindow": { "startMs": 12000, "endMs": 28000 },
  "evidenceChannels": ["asr", "ocr"],
  "requiredFacts": ["输入阶段", "反馈阶段"],
  "forbiddenClaims": ["视频提出了三个阶段"],
  "answerability": "answerable",
  "expectedHits": [
    { "segmentId": "segment-demo-002", "startMs": 15000, "endMs": 23000, "channel": "asr" }
  ],
  "review": { "status": "approved", "reviewerCount": 2, "notes": "虚构教学示例" }
}
